{
  "schema_version": 3,
  "versions": {
    "schema": "3",
    "state": "s1",
    "frame": "f1",
    "ontology": "o1",
    "isa": "i1",
    "world": "w1",
    "task": "t1",
    "evidence": "e1"
  },
  "partitions": {},
  "cells": [],
  "capability_graph": {},
  "action": "split",
  "source_version": "bound",
  "target_version": "bound",
  "migrations": [],
  "closed_cache_refs": []
}
